title,date,summary,pdf_link,epub_link,mobi_link,downloaded_pdf,downloaded_epub,downloaded_mobi
Nature Books & Arts Special 2015 No. 2,,"Plunge into a profusion of brilliant summer reads suggested by regular reviewers and editors, far away from the lab and lecture hall.",https://www.scientificamerican.com/index.cfm/_api/render/file/?method=inline&amp;fileID=42F22CA5-F48C-4673-80F598720024712D,,,nature_Books_and_Arts_Special_2015_2.pdf,,
Nature Research Briefings: Cancer,,Nature Research Briefings: Cancer is a collection of recently published Research Highlights selected from across the Nature Publishing Group journals. Each edition highlights some of the latest and most exciting developments in this key area of interest.,https://www.scientificamerican.com/index.cfm/_api/render/file/?method=inline&amp;fileID=989A7F13-B259-4D0E-AF95F4A36C9C86A4,,,Nature-Research-Briefing-Cancer.pdf,,
Nature Collections: Visual Strategies for Biological Data,,"This e-book collects the Points of View columns published in Nature Methods through February 2015, providing practical advice on effective strategies for visualizing biological data to researchers in the biological sciences. ",https://www.scientificamerican.com/index.cfm/_api/render/file/?method=inline&amp;fileID=E48A18CA-560A-40EF-9C2B049E1F4FA267,,,NatCollection_PoV_Final.pdf,,
Nature Collections: Climate Change Countdown,,"The countdown is on to reach a climate change agreement. The articles in this PDF collection, published in Nature Geoscience and Nature Climate Change, take stock of CO2 emissions and discuss how to share carbon budgets equitably.",https://www.scientificamerican.com/index.cfm/_api/render/file/?method=inline&amp;fileID=22CD1A02-80EA-455B-BC89D2012581A2FC,,,ClimateChangeCountdown.pdf,,
Nature: Spring Books 2014,,"Nature’s picks of the season. This collection of in-depth book reviews covers topics ranging from ecology to education, energy to medicine. A glimpse at what’s new in paperback rounds up this essential guide to the fresh science reads. Nature’s Spring Books 2014 special can be purchased and downloaded to save and enjoy.",https://www.scientificamerican.com/index.cfm/_api/render/file/?method=inline&amp;fileID=A5EFA83D-A92C-482A-B2D6AEFBA46765AF,,,Nature_Spring_Books_2014.pdf,,
Nature: Summer Books 2014,,"Choose your next adventure. Nature’s regular book reviewers share their summer reading selections in this PDF collection. Use this collection of book reviews to guide your next reading adventure, or simply while away some time in the sun.
Nature’s Summer Books 2014 special can be purchased and downloaded to save and enjoy.",https://www.scientificamerican.com/index.cfm/_api/render/file/?method=inline&amp;fileID=38E4890C-A959-4249-B7EEF4D6CCEBE5A3,,,Nature-Summer-Books-2014.pdf,,
Nature Collections: Chemistry,,"The Nature journals are the home of eye-opening chemistry. This collection presents our pick of the chemical sciences from 2014. A News Feature tells you all you need to know about the reinvention of rechargeable batteries. There’s expert opinion about papers in three exciting areas: electrochemistry for fuel production; flexible metal–organic frameworks for molecular separations; and synthetic organic chemistry. And a brace of papers includes top research from the fields of carbon nanotechnology and chemical biology. If you want to know what’s hot in chemistry, this is the place to look!",https://www.scientificamerican.com/index.cfm/_api/render/file/?method=inline&amp;fileID=7454F349-5C8B-4987-97BAC4E78DA1F134,,,Nature-Chemistry-Collection-2014.pdf,,
Nature Collections: General Relativity at 100,,"In November 1915, Albert Einstein completed his general theory of relativity, which linked gravity to the curvature of space-time. Throughout the following 100 years, experiments confirmed the theory to ever-higher precision, and theorists unravelled implications that even Einstein had not dreamed of, from the Big Bang to black holes. From Einstein’s own account of the genesis of general relativity to Stephen Hawking’s paper on black hole radiation, this anniversary package collects research papers, commentary and review articles that marked the milestones of the theory in the pages of Nature.",https://www.scientificamerican.com/index.cfm/_api/render/file/?method=inline&amp;fileID=055B1891-BAAC-47BB-82981F478CA1D52C,,,Einstein_ebook.pdf,,
Nature Collections: 150 Years of Mendel,,"Drawn from Nature’s archive, this collection of articles celebrates the 150th anniversary of the publication of Gregor Mendel’s work on heredity. Beginning with the replication of Mendel’s findings in 1900 and ending with the cracking of the genetic code in the 1960s, the package offers a unique insight into the science and the scientists that make up the history of Mendelian genetics.",https://www.scientificamerican.com/index.cfm/_api/render/file/?method=inline&amp;fileID=0355D72C-E4AE-4CCB-AB8F2F46EBEFD6BF,,,150 years of Mendel.pdf,,
Nature Research Briefings: Graphene,,Nature Research Briefings: Graphene is a collection of recently published Research Highlights and News and Views selected from across the Nature Publishing Group journals. Each edition highlights some of the latest and most exciting developments in this key area of interest.,https://www.scientificamerican.com/index.cfm/_api/render/file/?method=inline&amp;fileID=3C351CA3-1C3D-42C5-9097B5D04922A349,,,Nature-Research-Briefings-Graphene.pdf,,
Nature Tasting Menu,,"Nature Tasting Menu features a collection of recent news, features, editorial commentaries, and science fiction from the past year.",https://www.scientificamerican.com/index.cfm/_api/render/file/?method=inline&amp;fileID=D67084FA-E89F-456D-8EC9E3DEC647C4E2,,,Nature Tasting Menu 2016-1.pdf,,
Nature Books and Arts Special: 2014. No 1,,"A collection of book reviews for the scientifically adept and the perennially curious. Nature’s latest Books and Arts Special has winnowed the tsunami of science offerings to this short wave of essential reads, assessed by some of the most authoritative voices in science today. Available for FREE in PDF format to download and save – dip in today.",https://www.scientificamerican.com/index.cfm/_api/render/file/?method=inline&amp;fileID=51FF9BF0-9122-4E3B-96F7C36C4E38B429,,,nature-books-and-arts-special-2014-1.pdf,,
Books & Arts Special 2015 No.1,,"In Nature’s first book reviews supplement for 2015, leading experts review the season’s top reads. Picks cover a wide range of themes and topics, including the economic logic for urgent climate action, the reframing of general relativity, the discovery of the polio vaccine, a life leading the battle against AIDS, the mixed metaphors of junk DNA and the energetic leap that jump-started multicellular life.",https://www.scientificamerican.com/index.cfm/_api/render/file/?method=inline&amp;fileID=A81F3926-ADFE-49BC-B2CB9D36D8723B90,,,nature-books-and-arts-special-2015-1.pdf,,
Nature Collections: Stem Cells – Breaking Barriers,,"The most versatile of stem cells can be made from an embryo or by reprogramming mature cells. The much-awaited breakthrough of making stem cells from cloned human embryos has re-opened debate on distinctions between cell types. A selection of general articles from Nature highlight the practical, political and ethical considerations of using these cells in research and potential therapies.",https://www.scientificamerican.com/index.cfm/_api/render/file/?method=inline&amp;fileID=1D2CEE45-2283-410F-8D5F4C4A24002AA6,,,StemCells-BB.pdf,,
Nature Collections: Homo Floresiensis – the ‘hobbit’ 10 years on,,"The remains of the tiny hominin Homo floresiensis (nicknamed the ‘hobbit’) still raise supersize questions ten years after the publication in Nature of their discovery in a cave on the remote island of Flores in Indonesia. This collection of reporting, comment and research -- new and from Nature’s archives -- examines the controversy surrounding the origins of this species, including whether it belongs in our genus, Homo.",https://www.scientificamerican.com/index.cfm/_api/render/file/?method=inline&amp;fileID=578E67FF-E70B-4DA0-A5DB68A636E36AA3,,,nature-homo-floresiensis.pdf,,
Nature Collections: Year of Light,,"The United Nations has designated 2015 the International Year of Light and Light-based Technologies. It marks anniversaries including one of the first scientific accounts of optics published by the Islamic scholar Ibn al-Haytham in 1015; August Fresnel’s proposal in 1815 that light is a wave; James Clerk Maxwell’s 1865 electromagnetic theory of light; Albert Einstein’s 1915 theory of General Relativity; and in 1965 the discovery of the cosmic microwave background radiation and the development of optical fibres for communication.
This collection of news and comment articles explores how scientists are today pushing the properties of light to new extremes. It also includes 13 classic research papers that established the nature of light over the past century, from the discovery of X-rays to rapid laser pulses.",https://www.scientificamerican.com/index.cfm/_api/render/file/?method=inline&amp;fileID=B605F2CE-0558-4EA7-8E902C08FC582E1F,,,Nature_year_of_light_collection.pdf,,
